{
 "__meta__": {
  "generated_utc": "2026-10-18T00:00:06Z",
  "method": "deployed_engine_season_rank_correlation",
  "granularity": "season",
  "baseline": "prior_season_points (last year's finish)",
  "note": "Walk-forward: season S projected from seasons <= S-1 only, through the DEPLOYED engine (scripts.models.player_projection.project_player), whose week-1 RoS total is identical to the value app/ros.js renders. Written by scripts/backtest_player.py; the retired scripts/backtest_ros.py proxy formula now appears only as a baseline in data/player_backtest.json. At day-zero weights proj_points == prior_season_points under the shipped total rule (R49: the games-normalized rule is the CANDIDATE baseline, gated by player_backtest.json baseline_gate), so rho_ros and rho_lastyear are the SAME NUMBERS by construction and no position can beat the baseline until a signal earns weight."
 },
 "per_season": [
  {
   "season": 2022,
   "positions": {
    "QB": {
     "n": 26,
     "rho_ros": 0.4749,
     "rho_lastyear": 0.4236,
     "ndcg_ros": 0.8593,
     "ndcg_lastyear": 0.8503,
     "beats_baseline": true,
     "measured": true
    },
    "RB": {
     "n": 18,
     "rho_ros": 0.4572,
     "rho_lastyear": 0.2095,
     "ndcg_ros": 0.874,
     "ndcg_lastyear": 0.8491,
     "beats_baseline": true,
     "measured": true
    },
    "WR": {
     "n": 39,
     "rho_ros": 0.6868,
     "rho_lastyear": 0.6753,
     "ndcg_ros": 0.9065,
     "ndcg_lastyear": 0.9178,
     "beats_baseline": true,
     "measured": true
    },
    "TE": {
     "n": 27,
     "rho_ros": 0.6606,
     "rho_lastyear": 0.6271,
     "ndcg_ros": 0.8483,
     "ndcg_lastyear": 0.8306,
     "beats_baseline": true,
     "measured": true
    }
   }
  },
  {
   "season": 2023,
   "positions": {
    "QB": {
     "n": 25,
     "rho_ros": 0.4115,
     "rho_lastyear": 0.3685,
     "ndcg_ros": 0.8399,
     "ndcg_lastyear": 0.8085,
     "beats_baseline": true,
     "measured": true
    },
    "RB": {
     "n": 32,
     "rho_ros": 0.3303,
     "rho_lastyear": 0.3136,
     "ndcg_ros": 0.8597,
     "ndcg_lastyear": 0.9058,
     "beats_baseline": true,
     "measured": true
    },
    "WR": {
     "n": 57,
     "rho_ros": 0.8024,
     "rho_lastyear": 0.7834,
     "ndcg_ros": 0.8827,
     "ndcg_lastyear": 0.8899,
     "beats_baseline": true,
     "measured": true
    },
    "TE": {
     "n": 34,
     "rho_ros": 0.4773,
     "rho_lastyear": 0.4966,
     "ndcg_ros": 0.8278,
     "ndcg_lastyear": 0.8985,
     "beats_baseline": false,
     "measured": true
    }
   }
  },
  {
   "season": 2024,
   "positions": {
    "QB": {
     "n": 28,
     "rho_ros": 0.5391,
     "rho_lastyear": 0.5692,
     "ndcg_ros": 0.8241,
     "ndcg_lastyear": 0.8324,
     "beats_baseline": false,
     "measured": true
    },
    "RB": {
     "n": 45,
     "rho_ros": 0.7205,
     "rho_lastyear": 0.6085,
     "ndcg_ros": 0.9157,
     "ndcg_lastyear": 0.8307,
     "beats_baseline": true,
     "measured": true
    },
    "WR": {
     "n": 76,
     "rho_ros": 0.6355,
     "rho_lastyear": 0.654,
     "ndcg_ros": 0.8741,
     "ndcg_lastyear": 0.8591,
     "beats_baseline": false,
     "measured": true
    },
    "TE": {
     "n": 40,
     "rho_ros": 0.633,
     "rho_lastyear": 0.5838,
     "ndcg_ros": 0.7847,
     "ndcg_lastyear": 0.7513,
     "beats_baseline": true,
     "measured": true
    }
   }
  },
  {
   "season": 2025,
   "positions": {
    "QB": {
     "n": 34,
     "rho_ros": 0.4723,
     "rho_lastyear": 0.4463,
     "ndcg_ros": 0.8077,
     "ndcg_lastyear": 0.7553,
     "beats_baseline": true,
     "measured": true
    },
    "RB": {
     "n": 56,
     "rho_ros": 0.7212,
     "rho_lastyear": 0.6692,
     "ndcg_ros": 0.8736,
     "ndcg_lastyear": 0.8606,
     "beats_baseline": true,
     "measured": true
    },
    "WR": {
     "n": 97,
     "rho_ros": 0.659,
     "rho_lastyear": 0.59,
     "ndcg_ros": 0.839,
     "ndcg_lastyear": 0.8111,
     "beats_baseline": true,
     "measured": true
    },
    "TE": {
     "n": 45,
     "rho_ros": 0.6025,
     "rho_lastyear": 0.5739,
     "ndcg_ros": 0.7679,
     "ndcg_lastyear": 0.7881,
     "beats_baseline": true,
     "measured": true
    }
   }
  }
 ],
 "pooled": {
  "QB": {
   "n": 113,
   "rho_ros": 0.4728,
   "rho_lastyear": 0.4495,
   "ndcg_ros": 0.8343,
   "ndcg_lastyear": 0.785,
   "beats_baseline": true,
   "measured": true,
   "delta": 0.0233
  },
  "RB": {
   "n": 151,
   "rho_ros": 0.6356,
   "rho_lastyear": 0.5538,
   "ndcg_ros": 0.7562,
   "ndcg_lastyear": 0.7258,
   "beats_baseline": true,
   "measured": true,
   "delta": 0.0818
  },
  "WR": {
   "n": 269,
   "rho_ros": 0.6868,
   "rho_lastyear": 0.6673,
   "ndcg_ros": 0.7884,
   "ndcg_lastyear": 0.7846,
   "beats_baseline": true,
   "measured": true,
   "delta": 0.0195
  },
  "TE": {
   "n": 146,
   "rho_ros": 0.603,
   "rho_lastyear": 0.5997,
   "ndcg_ros": 0.7954,
   "ndcg_lastyear": 0.7796,
   "beats_baseline": true,
   "measured": true,
   "delta": 0.0033
  }
 },
 "summary": {
  "positions_beating_baseline": 4,
  "positions_scored": 4
 }
}
